{
  "case_id": "CASE-001",
  "name": "小穹",
  "version": "13.80",
  "author": "FL",
  "analysis_date": "2026-09-28（本地第4–6轮报告日期；前3轮独立时间未恢复）",
  "file_count": 949,
  "lua_file_count": 186,
  "content_hash": "52c1cbe65297d77ae006613c33955199f87b835a04fea9fe27427ac1c0361f71",
  "hash_algorithm": "对按完整路径排序的文件：依次 hash.update(relative_posix_path.encode(UTF8)); hash.update(SHA256(file_bytes).digest())。",
  "runtime_tested": false,
  "dedicated_server_tested": false,
  "source_available_in_package": false,
  "provenance": {
    "derived_from_entry": "CASE-001",
    "source_registry_id": "META-MODINFO",
    "source_status": "metadata extracted previously; original source excluded"
  }
}
